{
  "$schema": "./feature_schema.json",
  "project": "agent-diagnosis",
  "description": "Locked feature ledger. One feature is worked at a time, in dependency order. Locked fields cannot change without bumping lock_version and adding a changelog entry; tests/test_harness.py fails otherwise.",
  "lock_version": 2,
  "locked_at": "2026-08-12",
  "locked_fields": [
    "id",
    "area",
    "title",
    "why",
    "depends_on",
    "acceptance",
    "verify",
    "milestone"
  ],
  "mutable_fields": [
    "status",
    "sessions",
    "notes",
    "started_at",
    "completed_at",
    "blocked_reason"
  ],
  "status_values": [
    "locked",
    "in_progress",
    "blocked",
    "done",
    "dropped"
  ],
  "policy": {
    "one_at_a_time": "Exactly one feature may be in_progress. Starting a second is an error.",
    "definition_of_done": "status=done requires every acceptance item satisfied AND the verify command exiting 0 AND a session log entry referencing the feature id.",
    "dropping": "A feature may be dropped, never silently deleted. Dropping requires a changelog entry stating why.",
    "adding": "New features append with the next id and require a lock_version bump."
  },
  "changelog": [
    {
      "lock_version": 1,
      "date": "2026-08-12",
      "change": "Initial lock. 8 completed foundation features recorded for provenance; 14 backlog features derived from research/preregistration.md milestones and the two defects surfaced by the first end-to-end run."
    },
    {
      "lock_version": 2,
      "date": "2026-08-12",
      "change": "F-017 (B1 whole-trace LLM) reprioritised ahead of F-010..F-016 at researcher direction. Two locked-field changes: (a) dependency on F-015 removed -- it was over-specified, since B1 needs only the data model (F-002) and the metrics layer (F-005), both done; F-015 consumes B1's output rather than producing anything B1 needs. (b) acceptance extended with three measures the researcher specified: evidence grounding, unsupported explanation rate, confidence calibration. Also narrows the input tier to VISIBLE per researcher spec, which contradicts the pre-registration's 'fully unredacted trace'; both views are implemented and reported, and pre-registration amendment P1 records the tension."
    }
  ],
  "features": [
    {
      "id": "F-001",
      "area": "foundation",
      "title": "Frozen probe contract and pre-registration",
      "why": "Freezing probe semantics before the generator exists is the anti-circularity device the whole result rests on. Without a dated artefact there is no defence against the charge that probes were tuned to the corpus.",
      "depends_on": [],
      "acceptance": [
        "research/probe-contract.md exists, is dated before src/trace/synthesize.py, and carries a write-once amendment section",
        "research/preregistration.md states one primary hypothesis, secondary metrics, baselines, and kill criteria K1-K5",
        "every amendment to the contract is dated and states its consequence"
      ],
      "verify": "test -f research/probe-contract.md && test -f research/preregistration.md",
      "milestone": "M0",
      "status": "done",
      "sessions": [
        "0001",
        "0002"
      ],
      "completed_at": "2026-08-12",
      "notes": "Amendment A1 moved tool names and arguments to the visible tier."
    },
    {
      "id": "F-002",
      "area": "foundation",
      "title": "Trace data model with a three-tier visibility boundary",
      "why": "The experiment is meaningless unless the diagnostic agent provably cannot see hidden state. Visibility must be declared as data and enforced by tests, not asserted in prose.",
      "depends_on": [
        "F-001"
      ],
      "acceptance": [
        "schemas/trace_schema.json tags every field VISIBLE, PROBE or HIDDEN via x-visibility",
        "src/trace/models.py mirrors the schema and make_observation() is the only path from Trace to Observation",
        "a test walks the Observation object graph and asserts GroundTruth is unreachable",
        "a test asserts the Python visible tier matches the schema's VISIBLE set"
      ],
      "verify": "pytest tests/test_contract.py -q -k 'l3 or visible_tier or probe_gated'",
      "milestone": "M1",
      "status": "done",
      "sessions": [
        "0002",
        "0003"
      ],
      "completed_at": "2026-08-12",
      "notes": ""
    },
    {
      "id": "F-003",
      "area": "foundation",
      "title": "Six-probe catalog implementing the contract",
      "why": "Probes are the action space. They must be read-only, individually priced, charged even when inapplicable, and incapable of returning a diagnosis.",
      "depends_on": [
        "F-001",
        "F-002"
      ],
      "acceptance": [
        "all six probes registered, one module each, prices frozen in src/probes/base.py",
        "an inapplicable probe returns ok=False and is charged in full",
        "no probe mutates the trace",
        "replay_tool_call can return divergence=unavailable as a first-class answer"
      ],
      "verify": "pytest tests/test_contract.py -q -k 'probe'",
      "milestone": "M1",
      "status": "done",
      "sessions": [
        "0002"
      ],
      "completed_at": "2026-08-12",
      "notes": ""
    },
    {
      "id": "F-004",
      "area": "foundation",
      "title": "Episode loop with budget accounting and forced escalation",
      "why": "The environment must own the trace and hand out only observations. Budget exhaustion has to be an escalation, never a free guess, or probe count stops measuring anything.",
      "depends_on": [
        "F-003"
      ],
      "acceptance": [
        "run_episode charges every probe, applicable or not",
        "budget exhaustion terminates as budget_exhausted with no mechanism",
        "every episode records an auditable transcript"
      ],
      "verify": "pytest tests/test_contract.py -q -k 'budget or charged'",
      "milestone": "M1",
      "status": "done",
      "sessions": [
        "0002"
      ],
      "completed_at": "2026-08-12",
      "notes": ""
    },
    {
      "id": "F-005",
      "area": "foundation",
      "title": "Attribution-primary scoring with escalation-aware accuracy",
      "why": "Excluding escalations from the denominator lets a policy protect its score by refusing hard cases. Localization must be conditioned on correct attribution so a lucky step guess earns nothing.",
      "depends_on": [
        "F-004"
      ],
      "acceptance": [
        "attribution correct = right mechanism, or escalation when the truth is out of taxonomy",
        "localization scored only over correctly attributed in-taxonomy episodes",
        "crash_step_confusion reported separately",
        "paired bootstrap over trace ids with 95% CI"
      ],
      "verify": "python -c \"import sys; sys.path.insert(0,'src'); import evaluation.metrics\"",
      "milestone": "M1",
      "status": "done",
      "sessions": [
        "0003"
      ],
      "completed_at": "2026-08-12",
      "notes": "Replaced an earlier blended cost scalar that required defending a stipulated cost matrix."
    },
    {
      "id": "F-006",
      "area": "corpus",
      "title": "Eleven-family synthetic case generator",
      "why": "Realistic failed traces with ground truth derived from construction rather than annotation. Two families are deliberately invisible to any single probe, which is what makes sequential probing worth studying.",
      "depends_on": [
        "F-003"
      ],
      "acceptance": [
        "all eleven families implemented, one template each",
        "labels are a byproduct of construction; no mechanism name written to any field",
        "surface errors drawn from a shared ambiguous pool",
        "silent failures occur in in-taxonomy families too"
      ],
      "verify": "python experiments/build_cases.py",
      "milestone": "M2",
      "status": "done",
      "sessions": [
        "0003",
        "0004"
      ],
      "completed_at": "2026-08-12",
      "notes": "wrong_tool_selected reclassified H2 -> H1 at the researcher's direction."
    },
    {
      "id": "F-007",
      "area": "corpus",
      "title": "Probe-sufficiency verifier by subset search",
      "why": "Every case must contain evidence reachable through probes, and that is checkable. Checking it by running the policy's belief model conflates corpus quality with policy quality and nearly caused eight sound cases to be rewritten.",
      "depends_on": [
        "F-006"
      ],
      "acceptance": [
        "G6 verified by subset existence, not by a full-sweep posterior",
        "oracle_probes reported per case and in aggregate",
        "held-out family verified to produce no anomalous signature",
        "a test fails if either cross-evidence family becomes single-probe solvable"
      ],
      "verify": "pytest tests/test_contract.py -q -k 'g6 or cross_evidence or held_out'",
      "milestone": "M2",
      "status": "done",
      "sessions": [
        "0004"
      ],
      "completed_at": "2026-08-12",
      "notes": "Mean oracle probes 1.22 on the inspection corpus."
    },
    {
      "id": "F-008",
      "area": "corpus",
      "title": "Empirical leakage guard: visible-only baseline and G5",
      "why": "Lexical leakage checks pass while a corpus is broken. The first generator wrote mechanism-specific strings into final_error and a zero-probe baseline reached 0.858 attribution accuracy; only running that baseline caught it.",
      "depends_on": [
        "F-006"
      ],
      "acceptance": [
        "VisibleOnlyPolicy implemented as a genuine best use of the visible tier",
        "G5 rejects any corpus where it exceeds 0.55 attribution accuracy",
        "build_cases.py reports the number on every run"
      ],
      "verify": "python experiments/build_cases.py",
      "milestone": "M2",
      "status": "done",
      "sessions": [
        "0003",
        "0004"
      ],
      "completed_at": "2026-08-12",